[{"contractVersion":"structured-evidence-v1","taskId":"TEST_FIXTURE_TASK_001","executionId":"TEST_FIXTURE_EXECUTION_001","sourceId":"34991052e3058acd369672f5e4d7715391c6f66c4615c2761345664ea01e3224","snapshotId":null,"sourceUrl":"https://example.com/test-fixture/blocked","retrievedAt":null,"httpStatus":null,"contentType":null,"visibleText":"","contentHash":null,"snapshotReference":null,"acquisitionStatus":"blocked","errorCode":"robots_blocked","fixtureMetadata":{"marker":"TEST_FIXTURE","isTestFixture":true,"productionEligible":false,"scenario":"blocked"}}]
