[{"contractVersion":"structured-evidence-v1","taskId":"TEST_FIXTURE_TASK_001","executionId":"TEST_FIXTURE_EXECUTION_001","sourceId":"d5de69370b7149be1cd81da0a204e6b32df3433f92376bbac3c805b562d946d5","snapshotId":"de170f605d070465c4436ca22e0c159a4d73cdbe3324a286bb4555c58bb7830d","sourceUrl":"https://example.com/test-fixture/no-signal","retrievedAt":"2026-07-18T00:01:00.000Z","httpStatus":200,"contentType":"text/plain","visibleText":"TEST_FIXTURE normal public product page with no suspicious signal.","contentHash":"a38fb29432230db965e1f2d315d0a88b3cb3bcd7c4b06bb10687e04a77ab186c","snapshotReference":"evidence://TEST_FIXTURE/no-signal","acquisitionStatus":"acquired","errorCode":null,"fixtureMetadata":{"marker":"TEST_FIXTURE","isTestFixture":true,"productionEligible":false,"scenario":"no_signal"}}]
