[{"contractVersion":"structured-evidence-v1","taskId":"TEST_FIXTURE_TASK_001","executionId":"TEST_FIXTURE_EXECUTION_001","sourceId":"ebb44e0c32c3f182accfeb93e80c9a4ae386d062842e5f075a2815deeeaa8e58","snapshotId":"f5553a00b973c1a0e9ffb54ccf6dad61c0189862ff1d0d842f25b8d8f5404430","sourceUrl":"https://example.com/test-fixture/synthetic-price-signal?a=1&b=2","retrievedAt":"2026-07-18T00:01:00.000Z","httpStatus":200,"contentType":"text/plain","visibleText":"TEST_FIXTURE synthetic listing price is 50 TRY while reference price is 100 TRY.","contentHash":"7a0a9dfd2a68dfe7d4d1472b80433e09ba5b4dafb263f695380c27af001bb818","snapshotReference":"evidence://TEST_FIXTURE/synthetic-signal","acquisitionStatus":"acquired","errorCode":null,"fixtureMetadata":{"marker":"TEST_FIXTURE","isTestFixture":true,"productionEligible":false,"scenario":"synthetic_signal"}}]
